company,search_term,url,people_also_search,people_also_search_companies,videos,people_also_ask
cj,reviews,https://www.google.com/search?q=cj+reviews,"Cj reviews complaints, Cj reviews reddit, CJ Affiliate, Cj reviews yelp",,"How To Make Money With CJ Affiliate | CJ Affiliate Program ... (YouTube, 8:32, Nov 29, 2023), CJ Dropshipping Review: Pros and Cons (YouTube, 17:29, Mar 25, 2021)","Is CJ trustworthy?, Is CJ Affiliate good for beginners?, How does CJ Affiliate pay you?, How much does it cost to join CJ Affiliate?"
cj,ratings,https://www.google.com/search?q=cj+ratings,"Cj ratings nba, Cj ratings all time, CJ Affiliate, Is CJ affiliate legit Reddit",,,"Is CJ trustworthy?, What is the rating of CJ Affiliate?, Is CJ Affiliate good for beginners?, What is the commission rate for CJ?"
cj, ,https://www.google.com/search?q=cj++,,,,"What does a CJ mean?, Is CJ A Boy or a girl?, What happened to CJ Whoopty, rapper?, Who is the rapper called CJ?"
cj affiliate,reviews,https://www.google.com/search?q=cj+affiliate+reviews,"Cj affiliate reviews reddit, Cj affiliate reviews complaints, CJ affiliate Reddit, Is CJ affiliate legit Reddit",,"How To Make Money With CJ Affiliate | CJ Affiliate Program ... (YouTube, 8:32, Nov 29, 2023), Commission Junction Affiliate Network Review (YouTube, 17:48, May 27, 2020), CJ Affiliate Program Review Plus 5 Ways To Make Money (YouTube, 16:34, Aug 30, 2021)","Is the CJ Affiliate program legit?, How much do CJ affiliates make?, Is CJ Affiliate good for beginners?, How does CJ Affiliate pay?"
cj affiliate,ratings,https://www.google.com/search?q=cj+affiliate+ratings,"CJ affiliate Reddit, Is CJ affiliate legit, CJ Affiliate commission rate, CJ Affiliate login","CJ Affiliate, ShareASale, ClickBank, Rakuten Advertising, Awin, Rakuten","How To Make Money With CJ Affiliate | CJ Affiliate Program ... (YouTube, 8:32, Nov 29, 2023), Commission Junction Affiliate Network Review (YouTube, 17:48, May 27, 2020)","Is CJ a good affiliate program?, How much do CJ affiliates make?, Is CJ Affiliate better than ClickBank?, How often does CJ Affiliate pay?"
cj affiliate, ,https://www.google.com/search?q=cj+affiliate++,"CJ Affiliate login, CJ Affiliate Tripadvisor, CJ Affiliate sign up, CJ Affiliate products",,"How To Use CJ Affiliate 2024 (Step-By-Step) (YouTube, 8:16, Jun 20, 2023), How To Make Money With CJ Affiliate 2024 (Step-By-Step For ... (YouTube, 9:03, Mar 21, 2023), How To Make Money With CJ Affiliate | CJ Affiliate Program ... (YouTube, 8:32, Nov 29, 2023)","Is CJ Affiliate real or fake?, How much does CJ Affiliate pay?, What do CJ affiliates do?, Is CJ Affiliate good for beginners?"
ShareASale,reviews,https://www.google.com/search?q=ShareASale+reviews,"Shareasale reviews reddit, Shareasale reviews bbb, ShareASale affiliate, ShareASale products",,,"Can you really make money with ShareASale?, Is sharesales.com legit?, Is ShareASale better than ClickBank?, Is ShareASale good for affiliate marketing?"
ShareASale,ratings,https://www.google.com/search?q=ShareASale+ratings,"Shareasale ratings today, ShareASale review Reddit, ShareASale products, Shareasale ratings 2021",,"ShareASale Tutorial: How I make $687.75 per day... (YouTube, 13:47, Aug 9, 2023), ShareASale Affiliate Program Tutorial For Beginners ... (YouTube, 9:16, Nov 28, 2022), SHAREASALE AFFILIATE PROGRAM REVIEW 🤑 EARN ... (YouTube, 6:38, Jan 20, 2020)","Is ShareASale affiliate legit?, Can you really make money with ShareASale?, Is ShareASale better than ClickBank?, Do influencers use ShareASale?"
ShareASale, ,https://www.google.com/search?q=ShareASale++,"ShareASale affiliate program, ShareASale login, ShareASale products, ShareASale affiliate login",,"ShareASale Tutorial: How I make $687.75 per day... (YouTube, 13:47, Aug 9, 2023), ShareASale Tutorial for Affiliate Marketing - Beginner's Guide ... (YouTube, 7:41, Oct 22, 2022), How To Create Affiliate Links On ShareASale (Affiliate ... (YouTube, 5:10, Nov 30, 2022)","Can you really make money with ShareASale?, What is ShareASale used for?, Does ShareASale have a monthly fee?, Is ShareASale better than ClickBank?"
ClickBank,reviews,https://www.google.com/search?q=ClickBank+reviews,"Clickbank reviews reddit, ClickBank products, Clickbank reviews bbb, ClickBank ScamAdviser",,"Is ClickBank Legit? Let’s Talk About the Pros and Cons (YouTube, 3:11, Feb 6, 2023), Clickbank Automated AI Product Reviews: Affiliate Marketing ... (YouTube, 9:25, Jul 26, 2023)","How trustworthy is ClickBank?, Can you really make money on ClickBank?, What is the downside of ClickBank?, Is it safe to pay with ClickBank?"
ClickBank,ratings,https://www.google.com/search?q=ClickBank+ratings,"Clickbank ratings bbb, ClickBank ScamAdviser, ClickBank products, Clickbank reviews Reddit",,,"How trustworthy is ClickBank?, What is the downside of ClickBank?, Does ClickBank pay well?, Is it safe to pay with ClickBank?"
ClickBank, ,https://www.google.com/search?q=ClickBank++,"ClickBank marketplace, clickbank.com login, ClickBank products, ClickBank sign up",,"Clickbank Affiliate Marketing 2024: How Beginners Are ... (YouTube, 25:33, Feb 28, 2024), How to Make Money with Clickbank Affiliate Marketing (YouTube, 20:23, 1 month ago), ClickBank for Beginners: How to Get Started in Under 15 ... (YouTube, 13:33, Apr 12, 2023)","Do you actually make money with ClickBank?, Is ClickBank legitimate?, What are the disadvantages of ClickBank?, How does ClickBank work exactly?"
Impact,reviews,https://www.google.com/search?q=Impact+reviews,"Impact reviews reddit, Impact reviews complaints, Impact Review meaning, Is Impact affiliate legit",,"Impact.com Review - Best Affiliate Network For Brands and Aff ... (YouTube, 4:08, May 9, 2024), New Impact Wrenches Show Price Doesn't Mean What it Used to (YouTube, 12:05, Jul 11, 2023), Milwaukee Impact Wrench vs M18 Fuel Impact Driver | TESTED! (YouTube, 11:00, Apr 13, 2024)","Is impact.com a legit site?, Is impact network legit?, Is impact the best affiliate program?, What is an impact review?"
Impact,ratings,https://www.google.com/search?q=Impact+ratings,"Impact ratings wwe, Impact ratings this week, Impact ratings today, Impact ratings by year",,,"What is the impact rating system?, What is the standard for impact rating?, What is an ESG impact rating?, What are the risk impact ratings?"
Impact, ,https://www.google.com/search?q=Impact++,"Impact login, Impact LoL, Impact company, Impact meaning",,,"What is the synonym of impact?, What is the biblical meaning of impact?, What does impact mean in someone's life?, Have an impact on synonyms?"
AWIN,reviews,https://www.google.com/search?q=AWIN+reviews,"Awin reviews reddit, Awin reviews complaints, Is Awin safe, Awin affiliate requirements","Awin, CJ Affiliate, ShareASale, Rakuten Advertising, ClickBank, Skimlinks",,"Is Awin a reputable company?, Is Awin good for affiliate marketing?, Does Awin pay well?, How does Awin make money?"
AWIN,ratings,https://www.google.com/search?q=AWIN+ratings,"Awin ratings reddit, Is Awin safe, Awin affiliate, Is Awin free",,,"Is Awin a reputable company?, Is Awin good for affiliate marketing?, Is Awin secure?, What companies use Awin?"
AWIN, ,https://www.google.com/search?q=AWIN++,"Awin login, Awin products, Awin affiliate, Awin UK",,,"What is Awin and how does it work?, What is the meaning of Awin?, What is Awin in English?, Is Awin legit?"
Rakuten Advertising,reviews,https://www.google.com/search?q=Rakuten+Advertising+reviews,"Rakuten affiliate program, Awin reviews",,,"Is Rakuten Advertising worth it?, How much does it cost to be a Rakuten advertiser?, What is the commission rate for Rakuten Advertising?, What does Rakuten Advertising do?"
Rakuten Advertising,ratings,https://www.google.com/search?q=Rakuten+Advertising+ratings,"Rakuten Advertising salary, Rakuten affiliate program, Rakuten Advertising Glassdoor","Rakuten Advertising, Rakuten, CJ Affiliate, ClickBank, ShareASale, Amazon.com",,"Is Rakuten advertising good?, What do you need for Rakuten affiliate program?"
Rakuten Advertising, ,https://www.google.com/search?q=Rakuten+Advertising++,"Rakuten affiliate, Rakuten Advertising Login, Rakuten Advertising jobs, Rakuten Affiliate sign up",,"How To Create and Use Rakuten Advertising Affiliate Account ... (YouTube, 47:34, Mar 25, 2024), How To Create Rakuten Advertising Affiliate Account [2023] (YouTube, 21:25, Oct 15, 2022), Introducing Affiliate Intelligence by Rakuten Advertising (YouTube, 0:48, Mar 25, 2024)","What does Rakuten Advertising do?, What is the commission rate for Rakuten Advertising?, How much does it cost to be a Rakuten advertiser?, Is Rakuten Marketing legit?"
Partnerize,reviews,https://www.google.com/search?q=Partnerize+reviews,"Partnerize pricing, Partnerize affiliate, Partnerize salary, PartnerStack reviews",,,"Who uses Partnerize?, How many employees does Partnerize have?, Where is Partnerize located?"
Partnerize,ratings,https://www.google.com/search?q=Partnerize+ratings,"Partnerize pricing, Partnerize affiliate, How to use Partnerize, Partnerize payment method",,,"How many employees does Partnerize have?, Who uses Partnerize?, Who uses Partnerize?, Where is Partnerize located?"
Partnerize, ,https://www.google.com/search?q=Partnerize++,"Partnerize login, Partnerize affiliate, Partnerize affiliate login, Partnerize sign up",,,"What are the benefits of Partnerize?, Who uses partnerize?, What is a partnerize platform?, How to make money with Partnerize?"
